Que es lo primero que se debe hacer cuando nos asigan un proyecto [1],Despues de hacer el analisis cual es el siguiente paso [2],Una vez que tenemos el diseño del programa que se hace [3],Cuando terminamos de programar que se hace despues [4],Cual es el nombre de la herramienta que nos ayuda a encontrar errores [1],Que programa nos ayuda a programar en equipo [2],En github que es lo primero que se debe de hacer si se decea participar en un proyecto [3],En github cuando se desea descargar los documentos se usa: [4],En github cuando se desea subir codigo se utiliza: [1],En github quien es el encargado de aceptar el Pull request [2],Que son las branches [3],Cuantas personas pueden participar en un proyecto en github [4],Para crear un repositotio nuevo se utiliza [3],El primer paso para subir un archivo es [2],El segundo paso para subir un archivo es [3],El tercer paso para subir un archivo es [2],Si el pull request es aceptado se utiliza [4],La elaboracion del pseudocodigo entra en la etapa de  [1],Que alimento oficial de TDA  [4],Para que carrera es la materia de TDA  [1],Lo primero que se debe de poner para iniciar un proyecto en github  [2],Git add* que hace [3]
Hacer el analisis,Realizar le diseño,Programar,Pruebas del programa,debugger,github,Fork,Clone,Pull Request,El dueño,Ramas que se van creando por los participantes,Las que quieran,Create a new repo,Git add archivo,Git commit -m,Git push,Merge pull request,diseño,Galletas,Telecomunicaciones,git init,sube todos los archivos
Hacer el diseño,Hacer el analisis,Hacer el analisis,Hacemos el analisis,Edgar,Sublime Text,Pull Requests,Fork,Clone,El usuario,Ramas de los arboles,20 maximo,Pull Requests,Git commit -m,Git add archivo,Git commit -m,git push,Analisis,Papas,Mecatronica,git add,sube un archivo
Programar,Programar,Realizar pruebas,Hacemos el pseudocodigo,emacs,Antares,Upload files,Pull Request,Fork,Nadie,La forma en la que se bajan los archivos,100 maximo,Clone,Git push,Git push,Git add archivo,Clone,Programar,Manzanas,Biomedica,git pull,Sube los archivos modificados
Realizar pruebas del programa,Realizar pruebas del programa,,,,Gmail,Clone,Upload files,Upload files,Todos pueden,Nada importante ,50 maximo,Fork,Ninguna de las anteriores,Ninguna de las anteriores,Ninguna de las anteriores,Fork,Pruebas,Ninguna de las anteriores,Industrial,git push,Sube los archivos antiguos
1,2,3,4,1,2,3,4,1,2,3,4,3,2,3,2,4,1,4,1,2,3
